¿Acaso no saben que su cuerpo es templo del Espíritu Santo, quien está en ustedes y al que han recibido de parte de Dios? Ustedes no son sus propios dueños (1 Corintios 6:19).
En cambio, el fruto del Espíritu es amor, alegría, paz, paciencia, amabilidad, bondad, fidelidad, humildad y dominio propio. No hay ley que condene estas cosas (Gálatas 5:22-23).
Pues, si ustedes, aun siendo malos, saben dar cosas buenas a sus hijos, ¡Cuánto más el Padre celestial dará el Espíritu Santo a quienes se lo pidan! (Lucas 11:13).
El Espíritu del Señor reposará sobre él, espíritu de sabiduría y de entendimiento, espíritu de consejo y de poder, espíritu de conocimiento y de temor del Señor (Isaías 11:2).
Y así, después de esperar con paciencia, Abraham recibió lo que se le había prometido (Hebreos 6:15).
El futuro de los justos es halagüeño, la esperanza de los malvados se desvanece (Proverbios 10:28).
